{
  "id": "ASM-EMIT-DDCB-RES-SET-001",
  "tier": "fidelity",
  "provenance": "z80-spec",
  "input": {
    "kind": "assembler-api",
    "cases": [
      {
        "name": "ddcb-res-set",
        "sourceLines": [
          "    ORG 0x8000",
          "    res 0,(ix+5),b",
          "    res 0,(ix+5),c",
          "    res 0,(ix+5),d",
          "    res 0,(ix+5),e",
          "    res 0,(ix+5),h",
          "    res 0,(ix+5),l",
          "    res 0,(ix+5)",
          "    res 0,(ix+5),a",
          "    res 1,(ix+5),b",
          "    res 1,(ix+5),c",
          "    res 1,(ix+5),d",
          "    res 1,(ix+5),e",
          "    res 1,(ix+5),h",
          "    res 1,(ix+5),l",
          "    res 1,(ix+5)",
          "    res 1,(ix+5),a",
          "    res 2,(ix+5),b",
          "    res 2,(ix+5),c",
          "    res 2,(ix+5),d",
          "    res 2,(ix+5),e",
          "    res 2,(ix+5),h",
          "    res 2,(ix+5),l",
          "    res 2,(ix+5)",
          "    res 2,(ix+5),a",
          "    res 3,(ix+5),b",
          "    res 3,(ix+5),c",
          "    res 3,(ix+5),d",
          "    res 3,(ix+5),e",
          "    res 3,(ix+5),h",
          "    res 3,(ix+5),l",
          "    res 3,(ix+5)",
          "    res 3,(ix+5),a",
          "    res 4,(ix+5),b",
          "    res 4,(ix+5),c",
          "    res 4,(ix+5),d",
          "    res 4,(ix+5),e",
          "    res 4,(ix+5),h",
          "    res 4,(ix+5),l",
          "    res 4,(ix+5)",
          "    res 4,(ix+5),a",
          "    res 5,(ix+5),b",
          "    res 5,(ix+5),c",
          "    res 5,(ix+5),d",
          "    res 5,(ix+5),e",
          "    res 5,(ix+5),h",
          "    res 5,(ix+5),l",
          "    res 5,(ix+5)",
          "    res 5,(ix+5),a",
          "    res 6,(ix+5),b",
          "    res 6,(ix+5),c",
          "    res 6,(ix+5),d",
          "    res 6,(ix+5),e",
          "    res 6,(ix+5),h",
          "    res 6,(ix+5),l",
          "    res 6,(ix+5)",
          "    res 6,(ix+5),a",
          "    res 7,(ix+5),b",
          "    res 7,(ix+5),c",
          "    res 7,(ix+5),d",
          "    res 7,(ix+5),e",
          "    res 7,(ix+5),h",
          "    res 7,(ix+5),l",
          "    res 7,(ix+5)",
          "    res 7,(ix+5),a",
          "    set 0,(ix+5),b",
          "    set 0,(ix+5),c",
          "    set 0,(ix+5),d",
          "    set 0,(ix+5),e",
          "    set 0,(ix+5),h",
          "    set 0,(ix+5),l",
          "    set 0,(ix+5)",
          "    set 0,(ix+5),a",
          "    set 1,(ix+5),b",
          "    set 1,(ix+5),c",
          "    set 1,(ix+5),d",
          "    set 1,(ix+5),e",
          "    set 1,(ix+5),h",
          "    set 1,(ix+5),l",
          "    set 1,(ix+5)",
          "    set 1,(ix+5),a",
          "    set 2,(ix+5),b",
          "    set 2,(ix+5),c",
          "    set 2,(ix+5),d",
          "    set 2,(ix+5),e",
          "    set 2,(ix+5),h",
          "    set 2,(ix+5),l",
          "    set 2,(ix+5)",
          "    set 2,(ix+5),a",
          "    set 3,(ix+5),b",
          "    set 3,(ix+5),c",
          "    set 3,(ix+5),d",
          "    set 3,(ix+5),e",
          "    set 3,(ix+5),h",
          "    set 3,(ix+5),l",
          "    set 3,(ix+5)",
          "    set 3,(ix+5),a",
          "    set 4,(ix+5),b",
          "    set 4,(ix+5),c",
          "    set 4,(ix+5),d",
          "    set 4,(ix+5),e",
          "    set 4,(ix+5),h",
          "    set 4,(ix+5),l",
          "    set 4,(ix+5)",
          "    set 4,(ix+5),a",
          "    set 5,(ix+5),b",
          "    set 5,(ix+5),c",
          "    set 5,(ix+5),d",
          "    set 5,(ix+5),e",
          "    set 5,(ix+5),h",
          "    set 5,(ix+5),l",
          "    set 5,(ix+5)",
          "    set 5,(ix+5),a",
          "    set 6,(ix+5),b",
          "    set 6,(ix+5),c",
          "    set 6,(ix+5),d",
          "    set 6,(ix+5),e",
          "    set 6,(ix+5),h",
          "    set 6,(ix+5),l",
          "    set 6,(ix+5)",
          "    set 6,(ix+5),a",
          "    set 7,(ix+5),b",
          "    set 7,(ix+5),c",
          "    set 7,(ix+5),d",
          "    set 7,(ix+5),e",
          "    set 7,(ix+5),h",
          "    set 7,(ix+5),l",
          "    set 7,(ix+5)",
          "    set 7,(ix+5),a",
          ""
        ],
        "options": {
          "entryPath": "ddcb-res-set.asm"
        }
      }
    ]
  },
  "expected": {
    "cases": [
      {
        "name": "ddcb-res-set",
        "ok": true,
        "bytesHex": "DDCB0580DDCB0581DDCB0582DDCB0583DDCB0584DDCB0585DDCB0586DDCB0587DDCB0588DDCB0589DDCB058ADDCB058BDDCB058CDDCB058DDDCB058EDDCB058FDDCB0590DDCB0591DDCB0592DDCB0593DDCB0594DDCB0595DDCB0596DDCB0597DDCB0598DDCB0599DDCB059ADDCB059BDDCB059CDDCB059DDDCB059EDDCB059FDDCB05A0DDCB05A1DDCB05A2DDCB05A3DDCB05A4DDCB05A5DDCB05A6DDCB05A7DDCB05A8DDCB05A9DDCB05AADDCB05ABDDCB05ACDDCB05ADDDCB05AEDDCB05AFDDCB05B0DDCB05B1DDCB05B2DDCB05B3DDCB05B4DDCB05B5DDCB05B6DDCB05B7DDCB05B8DDCB05B9DDCB05BADDCB05BBDDCB05BCDDCB05BDDDCB05BEDDCB05BFDDCB05C0DDCB05C1DDCB05C2DDCB05C3DDCB05C4DDCB05C5DDCB05C6DDCB05C7DDCB05C8DDCB05C9DDCB05CADDCB05CBDDCB05CCDDCB05CDDDCB05CEDDCB05CFDDCB05D0DDCB05D1DDCB05D2DDCB05D3DDCB05D4DDCB05D5DDCB05D6DDCB05D7DDCB05D8DDCB05D9DDCB05DADDCB05DBDDCB05DCDDCB05DDDDCB05DEDDCB05DFDDCB05E0DDCB05E1DDCB05E2DDCB05E3DDCB05E4DDCB05E5DDCB05E6DDCB05E7DDCB05E8DDCB05E9DDCB05EADDCB05EBDDCB05ECDDCB05EDDDCB05EEDDCB05EFDDCB05F0DDCB05F1DDCB05F2DDCB05F3DDCB05F4DDCB05F5DDCB05F6DDCB05F7DDCB05F8DDCB05F9DDCB05FADDCB05FBDDCB05FCDDCB05FDDDCB05FEDDCB05FF"
      }
    ]
  },
  "normalization": {
    "profile": "binary"
  }
}
