{
  "id": "ASM-EMIT-RST-P-001",
  "tier": "fidelity",
  "provenance": "z80-spec",
  "input": {
    "kind": "assembler-api",
    "cases": [
      {
        "name": "rst-all-vectors",
        "sourceLines": [
          "    ORG 0x8000",
          "    rst 0x00",
          "    rst 0x08",
          "    rst 0x10",
          "    rst 0x18",
          "    rst 0x20",
          "    rst 0x28",
          "    rst 0x30",
          "    rst 0x38",
          ""
        ],
        "options": {
          "entryPath": "rst-vectors.asm"
        }
      }
    ]
  },
  "expected": {
    "cases": [
      {
        "name": "rst-all-vectors",
        "ok": true,
        "bytesHex": "C7CFD7DFE7EFF7FF"
      }
    ]
  },
  "normalization": {
    "profile": "binary"
  }
}
