{
  "id": "ASM-EMIT-ED-NEG-001",
  "tier": "fidelity",
  "provenance": "z80-spec",
  "input": {
    "kind": "assembler-api",
    "cases": [
      {
        "name": "ed-neg",
        "sourceLines": [
          "    ORG 0x8000",
          "    neg",
          ""
        ],
        "options": {
          "entryPath": "ed-neg.asm"
        }
      }
    ]
  },
  "expected": {
    "cases": [
      {
        "name": "ed-neg",
        "ok": true,
        "bytesHex": "ED44"
      }
    ]
  },
  "normalization": {
    "profile": "binary"
  }
}
