{
  "id": "ASM-EMIT-CB-RES-SET-001",
  "tier": "fidelity",
  "provenance": "z80-spec",
  "input": {
    "kind": "assembler-api",
    "cases": [
      {
        "name": "cb-res-set",
        "sourceLines": [
          "    ORG 0x8000",
          "    res 0,b",
          "    res 0,c",
          "    res 0,d",
          "    res 0,e",
          "    res 0,h",
          "    res 0,l",
          "    res 0,(hl)",
          "    res 0,a",
          "    res 1,b",
          "    res 1,c",
          "    res 1,d",
          "    res 1,e",
          "    res 1,h",
          "    res 1,l",
          "    res 1,(hl)",
          "    res 1,a",
          "    res 2,b",
          "    res 2,c",
          "    res 2,d",
          "    res 2,e",
          "    res 2,h",
          "    res 2,l",
          "    res 2,(hl)",
          "    res 2,a",
          "    res 3,b",
          "    res 3,c",
          "    res 3,d",
          "    res 3,e",
          "    res 3,h",
          "    res 3,l",
          "    res 3,(hl)",
          "    res 3,a",
          "    res 4,b",
          "    res 4,c",
          "    res 4,d",
          "    res 4,e",
          "    res 4,h",
          "    res 4,l",
          "    res 4,(hl)",
          "    res 4,a",
          "    res 5,b",
          "    res 5,c",
          "    res 5,d",
          "    res 5,e",
          "    res 5,h",
          "    res 5,l",
          "    res 5,(hl)",
          "    res 5,a",
          "    res 6,b",
          "    res 6,c",
          "    res 6,d",
          "    res 6,e",
          "    res 6,h",
          "    res 6,l",
          "    res 6,(hl)",
          "    res 6,a",
          "    res 7,b",
          "    res 7,c",
          "    res 7,d",
          "    res 7,e",
          "    res 7,h",
          "    res 7,l",
          "    res 7,(hl)",
          "    res 7,a",
          "    set 0,b",
          "    set 0,c",
          "    set 0,d",
          "    set 0,e",
          "    set 0,h",
          "    set 0,l",
          "    set 0,(hl)",
          "    set 0,a",
          "    set 1,b",
          "    set 1,c",
          "    set 1,d",
          "    set 1,e",
          "    set 1,h",
          "    set 1,l",
          "    set 1,(hl)",
          "    set 1,a",
          "    set 2,b",
          "    set 2,c",
          "    set 2,d",
          "    set 2,e",
          "    set 2,h",
          "    set 2,l",
          "    set 2,(hl)",
          "    set 2,a",
          "    set 3,b",
          "    set 3,c",
          "    set 3,d",
          "    set 3,e",
          "    set 3,h",
          "    set 3,l",
          "    set 3,(hl)",
          "    set 3,a",
          "    set 4,b",
          "    set 4,c",
          "    set 4,d",
          "    set 4,e",
          "    set 4,h",
          "    set 4,l",
          "    set 4,(hl)",
          "    set 4,a",
          "    set 5,b",
          "    set 5,c",
          "    set 5,d",
          "    set 5,e",
          "    set 5,h",
          "    set 5,l",
          "    set 5,(hl)",
          "    set 5,a",
          "    set 6,b",
          "    set 6,c",
          "    set 6,d",
          "    set 6,e",
          "    set 6,h",
          "    set 6,l",
          "    set 6,(hl)",
          "    set 6,a",
          "    set 7,b",
          "    set 7,c",
          "    set 7,d",
          "    set 7,e",
          "    set 7,h",
          "    set 7,l",
          "    set 7,(hl)",
          "    set 7,a",
          ""
        ],
        "options": {
          "entryPath": "cb-res-set.asm"
        }
      }
    ]
  },
  "expected": {
    "cases": [
      {
        "name": "cb-res-set",
        "ok": true,
        "bytesHex": "CB80CB81CB82CB83CB84CB85CB86CB87CB88CB89CB8ACB8BCB8CCB8DCB8ECB8FCB90CB91CB92CB93CB94CB95CB96CB97CB98CB99CB9ACB9BCB9CCB9DCB9ECB9FCBA0CBA1CBA2CBA3CBA4CBA5CBA6CBA7CBA8CBA9CBAACBABCBACCBADCBAECBAFCBB0CBB1CBB2CBB3CBB4CBB5CBB6CBB7CBB8CBB9CBBACBBBCBBCCBBDCBBECBBFCBC0CBC1CBC2CBC3CBC4CBC5CBC6CBC7CBC8CBC9CBCACBCBCBCCCBCDCBCECBCFCBD0CBD1CBD2CBD3CBD4CBD5CBD6CBD7CBD8CBD9CBDACBDBCBDCCBDDCBDECBDFCBE0CBE1CBE2CBE3CBE4CBE5CBE6CBE7CBE8CBE9CBEACBEBCBECCBEDCBEECBEFCBF0CBF1CBF2CBF3CBF4CBF5CBF6CBF7CBF8CBF9CBFACBFBCBFCCBFDCBFECBFF"
      }
    ]
  },
  "normalization": {
    "profile": "binary"
  }
}
