{
  "id": "ASM-EMIT-JP-IXIY-001",
  "tier": "fidelity",
  "provenance": "z80-spec",
  "input": {
    "kind": "assembler-api",
    "cases": [
      {
        "name": "jp-index",
        "sourceLines": [
          "    ORG 0x8000",
          "    jp (ix)",
          "    jp (iy)",
          ""
        ],
        "options": {
          "entryPath": "jp-index.asm"
        }
      }
    ]
  },
  "expected": {
    "cases": [
      {
        "name": "jp-index",
        "ok": true,
        "bytesHex": "DDE9FDE9"
      }
    ]
  },
  "normalization": {
    "profile": "binary"
  }
}
